[
  { "id": "blinded", "name": "Blinded", "tags": ["physical"],
    "static": { "ownAttacks": "disadvantage", "attackedMelee": "advantage", "attackedRanged": "advantage" } },
  { "id": "charmed", "name": "Charmed", "tags": ["magical", "charm"],
    "static": { "ownAttacks": "disadvantage" } },
  { "id": "frightened", "name": "Frightened", "tags": ["fear"],
    "static": { "ownAttacks": "disadvantage" } },
  { "id": "grappled", "name": "Grappled", "tags": ["physical"],
    "static": { "cantMove": true } },
  { "id": "incapacitated", "name": "Incapacitated", "tags": [],
    "static": { "incapacitated": true } },
  { "id": "invisible", "name": "Invisible", "tags": ["magical"],
    "static": { "invisible": true } },
  { "id": "paralysed", "name": "Paralysed", "tags": ["magical"], "implies": "incapacitated",
    "static": { "cantMove": true, "autoFailSaves": ["str", "dex"], "attackedMelee": "advantage", "attackedRanged": "advantage",
                "critWhenAdjacent": true } },
  { "id": "poisoned", "name": "Poisoned", "tags": ["poison"],
    "static": { "ownAttacks": "disadvantage" } },
  { "id": "prone", "name": "Prone", "tags": ["physical"],
    "static": { "ownAttacks": "disadvantage", "attackedMelee": "advantage", "attackedRanged": "disadvantage" },
    "passives": [ { "id": "prone.stand_up", "hook": "onTurnStart", "target": "self", "effects": [ { "remove": "prone" } ] } ] },
  { "id": "restrained", "name": "Restrained", "tags": ["physical"],
    "static": { "cantMove": true, "ownAttacks": "disadvantage", "attackedMelee": "advantage", "attackedRanged": "advantage",
                "saveEdges": { "dex": "disadvantage" } } },
  { "id": "stunned", "name": "Stunned", "tags": ["magical"], "implies": "incapacitated",
    "static": { "autoFailSaves": ["str", "dex"], "attackedMelee": "advantage", "attackedRanged": "advantage" } },
  { "id": "unconscious", "name": "Unconscious", "tags": ["magical", "sleep"], "implies": "prone",
    "static": { "incapacitated": true, "cantMove": true, "autoFailSaves": ["str", "dex"], "attackedMelee": "advantage",
                "attackedRanged": "advantage", "critWhenAdjacent": true },
    "passives": [ { "id": "unconscious.wake", "hook": "onDamaged", "target": "self", "effects": [ { "remove": "unconscious" } ] } ] },

  { "id": "burning", "name": "Burning", "tags": ["fire"],
    "passives": [ { "id": "burning.tick", "hook": "onTurnStart", "target": "self",
                    "effects": [ { "damage": { "dice": "1d6", "type": "fire" } } ] } ] },
  { "id": "bleeding", "name": "Bleeding", "tags": ["physical", "bleed"],
    "passives": [ { "id": "bleeding.tick", "hook": "onTurnStart", "target": "self",
                    "effects": [ { "damage": { "dice": "1d4" } } ] } ] },
  { "id": "slowed", "name": "Slowed", "tags": ["magical"],
    "static": { "ac": -2, "initiative": -5, "move": -1, "saves": { "dex": -2 } } },
  { "id": "hasted", "name": "Hasted", "tags": ["magical"],
    "static": { "ac": 2, "initiative": 5, "move": 1, "extraActions": 1, "saveEdges": { "dex": "advantage" } } },
  { "id": "marked", "name": "Marked", "tags": ["mark"] },
  { "id": "lit", "name": "Lit", "tags": ["magical", "light"],
    "static": { "attackedMelee": "advantage", "attackedRanged": "advantage" },
    "passives": [ { "id": "lit.fades", "hook": "onDamaged", "target": "self", "effects": [ { "remove": "lit" } ] } ] },
  { "id": "taunted", "name": "Taunted", "tags": ["taunt"] },
  { "id": "helped", "name": "Helped", "tags": ["help"] },
  { "id": "dodging", "name": "Dodging", "tags": [],
    "static": { "attackedMelee": "disadvantage", "attackedRanged": "disadvantage", "saveEdges": { "dex": "advantage" } },
    "passives": [ { "id": "dodging.ends", "hook": "onTurnStart", "target": "self", "effects": [ { "remove": "dodging" } ] } ] },
  { "id": "disengaged", "name": "Disengaged", "tags": [] },

  { "id": "hidden", "name": "Hidden", "tags": ["stealth"],
    "static": { "invisible": true },
    "passives": [ { "id": "hidden.revealed_on_hit", "hook": "onAttackHit", "target": "self", "effects": [ { "remove": "hidden" } ] },
                  { "id": "hidden.revealed_on_miss", "hook": "onAttackMiss", "target": "self", "effects": [ { "remove": "hidden" } ] } ] },
  { "id": "mage_armor", "name": "Mage Armor", "tags": ["magical"], "static": { "ac": 3 } },
  { "id": "death_ward", "name": "Death Ward", "tags": ["magical"],
    "passives": [ { "id": "death_ward.save", "hook": "onDowned", "target": "self", "usesPerBattle": 1,
                    "effects": [ { "revive": { "hp": 1 } }, { "remove": "death_ward" } ] } ] }
]
